{
  "trade_outcome_id": "to_001",
  "decision_event_id": "de_001",
  "timestamp_utc": "2026-06-01T16:00:00Z",
  "outcome_schema_version": "trade-outcome-1.0.0",
  "contract_version": "v7-1.0.0",
  "event_schema_version": "decision-event-1.0.0",
  "simulation_family_version": "simfam-1.0.0",
  "request_id": "req_001",
  "engine_name": "v7",
  "engine_version": "1.0.0",
  "outcome_source": "PAPER_EXECUTION",
  "execution_path": "PAPER_EXECUTED",
  "execution_decision": "EXECUTED",
  "position_opened": true,
  "outcome_status": "RESOLVED",
  "is_final": true,
  "resolution_reason": "TARGET_HIT",
  "best_realized_action": "LONG_NOW",
  "realized_r": 1.82,
  "exit_reason": "TARGET_HIT",
  "mfe_r": 2.5,
  "mae_r": -0.35,
  "counterfactual_best_action": "LONG_NOW",
  "regret_r": 0,
  "saved_loss_score": 0.62,
  "missed_opportunity_score": 0.73,
  "path_quality_score": 0.82,
  "outcome_label": "CLEAN_LONG_OPPORTUNITY",
  "is_good_decision": true,
  "horizon_family": "swing_horizon"
}
